<?xml version="1.0" encoding="UTF-8" standalone="no"?>
<!DOCTYPE BUILDSET PUBLIC "PCGEN-GENERATORS" 'Generator.dtd'>
<BUILDSET>
    <EXT_GENERATOR name="High" uri="DefaultPurchaseGenerators.xml"/>
    <STANDARDMODE_GENERATOR name="3d6" assignable="true">
        <STAT>3d6</STAT>
        <STAT>3d6</STAT>
        <STAT>3d6</STAT>
        <STAT>3d6</STAT>
        <STAT>3d6</STAT>
        <STAT>3d6</STAT>
    </STANDARDMODE_GENERATOR>
    <STANDARDMODE_GENERATOR name="4d4" assignable="true">
        <STAT>4d4</STAT>
        <STAT>4d4</STAT>
        <STAT>4d4</STAT>
        <STAT>4d4</STAT>
        <STAT>4d4</STAT>
        <STAT>4d4</STAT>
    </STANDARDMODE_GENERATOR>
    <STANDARDMODE_GENERATOR name="4d6 drop lowest" assignable="true">
        <STAT>roll(4,6,top(3))</STAT>
        <STAT>roll(4,6,top(3))</STAT>
        <STAT>roll(4,6,top(3))</STAT>
        <STAT>roll(4,6,top(3))</STAT>
        <STAT>roll(4,6,top(3))</STAT>
        <STAT>roll(4,6,top(3))</STAT>
    </STANDARDMODE_GENERATOR>
    <STANDARDMODE_GENERATOR name="4d6, reroll 1's" assignable="true">
        <STAT>roll(4,6,reroll(1))</STAT>
        <STAT>roll(4,6,reroll(1))</STAT>
        <STAT>roll(4,6,reroll(1))</STAT>
        <STAT>roll(4,6,reroll(1))</STAT>
        <STAT>roll(4,6,reroll(1))</STAT>
        <STAT>roll(4,6,reroll(1))</STAT>
    </STANDARDMODE_GENERATOR>
    <STANDARDMODE_GENERATOR name="4d6, reroll 1's, drop the lowest" assignable="true">
        <STAT>roll(4,6,top(3),reroll(1))</STAT>
        <STAT>roll(4,6,top(3),reroll(1))</STAT>
        <STAT>roll(4,6,top(3),reroll(1))</STAT>
        <STAT>roll(4,6,top(3),reroll(1))</STAT>
        <STAT>roll(4,6,top(3),reroll(1))</STAT>
        <STAT>roll(4,6,top(3),reroll(1))</STAT>
    </STANDARDMODE_GENERATOR>
    <STANDARDMODE_GENERATOR name="5d6 drop 2 lowest" assignable="true">
        <STAT>roll(5,6,top(3))</STAT>
        <STAT>roll(5,6,top(3))</STAT>
        <STAT>roll(5,6,top(3))</STAT>
        <STAT>roll(5,6,top(3))</STAT>
        <STAT>roll(5,6,top(3))</STAT>
        <STAT>roll(5,6,top(3))</STAT>
    </STANDARDMODE_GENERATOR>
</BUILDSET>
